{
  "frontmatter": {
    "type": "method",
    "interface": "IFeatureManager",
    "member": "AdvancedHole",
    "returns": "Feature",
    "parameters": [
      {
        "name": "AdvancedHoleNearElementArray",
        "type": "System.Object",
        "description": "Array of near side hole data objects (see Remarks )"
      },
      {
        "name": "AdvancedHoleFarElementArray",
        "type": "System.Object",
        "description": "Array of far side hole data objects (see Remarks )"
      },
      {
        "name": "UseBaselineDimensions",
        "type": "System.Boolean",
        "description": "True to use baseline dimensions, false to not (see Remarks )"
      },
      {
        "name": "IsCustomCallout",
        "type": "System.Boolean",
        "description": "True to customize the hole callout, false to use a default hole callout (see Remarks )"
      },
      {
        "name": "ResultArray",
        "type": "System.Object",
        "description": "Array of result codes as defined in swAdvancedHoleResults_e (see Remarks )"
      }
    ],
    "docset": "sldworksapi",
    "deprecated": true,
    "since_version": "unknown",
    "categories": [
      "features"
    ],
    "related": [],
    "keywords": [
      "advancedhole",
      "ifeaturemanager",
      "feature",
      "manager",
      "advanced",
      "hole",
      "near",
      "element",
      "array",
      "object",
      "far",
      "use",
      "baseline",
      "dimensions",
      "boolean",
      "custom",
      "callout",
      "result"
    ]
  },
  "title": "IFeatureManager.AdvancedHole",
  "description": "Obsolete. Superseded by IFeatureManager::AdvancedHole2.",
  "signature": "Feature AdvancedHole( \n   System.Object\nAdvancedHoleNearElementArray\n,\n   System.Object\nAdvancedHoleFarElementArray\n,\n   System.Boolean\nUseBaselineDimensions\n,\n   System.Boolean\nIsCustomCallout\n,\n   out System.Object\nResultArray\n)",
  "parameters": [
    {
      "name": "AdvancedHoleNearElementArray",
      "type": "System.Object",
      "description": "Array of near side hole data objects (see Remarks )"
    },
    {
      "name": "AdvancedHoleFarElementArray",
      "type": "System.Object",
      "description": "Array of far side hole data objects (see Remarks )"
    },
    {
      "name": "UseBaselineDimensions",
      "type": "System.Boolean",
      "description": "True to use baseline dimensions, false to not (see Remarks )"
    },
    {
      "name": "IsCustomCallout",
      "type": "System.Boolean",
      "description": "True to customize the hole callout, false to use a default hole callout (see Remarks )"
    },
    {
      "name": "ResultArray",
      "type": "System.Object",
      "description": "Array of result codes as defined in swAdvancedHoleResults_e (see Remarks )"
    }
  ],
  "returns": "IFeature ; Nothing or null if this method results in an invalid geometry condition (see Remarks )",
  "remarks": "The Advanced Hole feature:\nis separate from the Hole Wizard functionality (see\nFeatureManager::HoleWizard5\n).\nconsists of several hole elements, e.g., counterbore, countersink, straight, and tapered tap, that are stacked from the near and far side faces inward. The near and far side stacks, combined, form the Advanced Hole.\ncan be added only to parts at this time.\nAdvancedHoleNearElementArray and AdvancedHoleFarElementArray each contain one or more hole type-specific objects in order as they stack from the near and far side faces:\nICounterboreElementData\nICountersinkElementData\nIStraightElementData\nIStraightTapElementData\nITaperedTapElementData\nThe hole type-specific interfaces above extend the parent interface,\nIAdvancedHoleElementData\n, which you use to set general Advanced Hole properties.\nUseBaseLineDimensions controls which hole type-specific properties are valid. See\nIAdvancedHoleFeatureData::UseBaselineDimensions\n.\nIsCustomCallout set to true allows you to set a custom callout string for individual hole elements using\nIAdvancedHoleElementData::CalloutString\n.\nResultArray contains a return code for each element in AdvancedHoleNearElementArray and AdvancedHoleFarElementArray. It is possible for this method to fail to create an advanced hole, even though ResultArray contains all success result codes. If the individual hole elements all combine to produce invalid geometry (e.g., a disjoint body or a self-intersecting face) or if incorrect near or far side faces are selected, then this method returns Nothing or null.\nTo create an Advanced Hole feature, follow the examples which do the following:\nCall\nIModelDocExtension::SelectByRay\nto select the near side (Mark = 256) and far side (Mark = 512) faces of the Advanced Hole. You must select these faces by location, so do not use\nIEntity::Select4\n.\nCall\nIModelDocExtension::CreateAdvancedHoleElementData\nto create an AdvancedHoleElementData object.\nSet the general Advanced Hole properties using the AdvancedHoleElementData object.\nCast the AdvancedHoleElementData object using one of the hole type-specific interfaces.\nSet the specific Advanced Hole properties using the hole type-specific object.\nRepeat steps 2 - 5 for each hole element you want to add to the near and far side stacks of the Advanced Hole.\nCreate near and far side arrays of the hole type-specific objects in stacking order from each face inward. The innermost elements of each stack should match to create a contiguous hole that extends from near side face to far side face.\nPass the near and far side arrays to IFeatureManager::AdvancedHole to create the Advanced Hole.\nDelete the defining Advanced Hole sketch point and call\nISketchManager::CreatePoint\none or more times to insert the Advanced Hole in multiple locations.\nTo edit an Advanced Hole feature, call\nIFeature::GetDefinition\nto access\nIAdvancedHoleFeatureData\n. See\nAccessing Selections that Define Features\n.",
  "examples": [],
  "related": []
}